------------------------------------------EXPERIMENT 5---------------------------------------------------------
--------------------------------------DML COMMAND- DELETE------------------------------------------------------






1. Delete the record of customer id ‘4’.

mysql> select * from customer;
+---------+----------+---------+-----------+-----------+
| cust_id | name     | address | city      | ph_no     |
+---------+----------+---------+-----------+-----------+
|       1 | Parvathi | ABC     | Tvm       | 919191919 |
|       2 | Reema    | WXY     | Kozhikode | 999999992 |
|       3 | Arun     | VWX     | Ekm       | 999999993 |
|       4 | Anju     | UVW     | Tvm       |      NULL |
|       5 | Ram      | TUV     | Ekm       |      NULL |
+---------+----------+---------+-----------+-----------+
5 rows in set (0.00 sec)

mysql> delete from customer where cust_id=4;
Query OK, 1 row affected (0.04 sec)

mysql> select * from customer;
+---------+----------+---------+-----------+-----------+
| cust_id | name     | address | city      | ph_no     |
+---------+----------+---------+-----------+-----------+
|       1 | Parvathi | ABC     | Tvm       | 919191919 |
|       2 | Reema    | WXY     | Kozhikode | 999999992 |
|       3 | Arun     | VWX     | Ekm       | 999999993 |
|       5 | Ram      | TUV     | Ekm       |      NULL |
+---------+----------+---------+-----------+-----------+
4 rows in set (0.00 sec)






------------------------------------------------------------------------------------------------------------------






2. Delete all purchase details of items its quantity less than 2.

mysql> select * from invoice_item;
+--------+------+----------+
| inv_id | pid  | quantity |
+--------+------+----------+
|    111 |  105 |        5 |
|    112 |  102 |        3 |
|    113 |  101 |        1 |
|    114 |  101 |        2 |
|    115 |  103 |        4 |
|    112 |  105 |        1 |
|    112 |  103 |        4 |
|    115 |  105 |        3 |
+--------+------+----------+
8 rows in set (0.00 sec)

mysql> delete from invoice_item where quantity<2;
Query OK, 2 rows affected (0.08 sec)

mysql> select * from invoice_item;
+--------+------+----------+
| inv_id | pid  | quantity |
+--------+------+----------+
|    111 |  105 |        5 |
|    112 |  102 |        3 |
|    114 |  101 |        2 |
|    115 |  103 |        4 |
|    112 |  103 |        4 |
|    115 |  105 |        3 |
+--------+------+----------+
6 rows in set (0.00 sec)






------------------------------------------------------------------------------------------------------------------



3. Delete the purchase details of product ‘pen’ in the inv_id=111.

mysql> select * from invoice_item;
+--------+------+----------+
| inv_id | pid  | quantity |
+--------+------+----------+
|    111 |  105 |        5 |
|    112 |  102 |        3 |
|    114 |  101 |        2 |
|    115 |  103 |        4 |
|    112 |  103 |        4 |
|    115 |  105 |        3 |
+--------+------+----------+
6 rows in set (0.00 sec)

mysql> delete from invoice_item where pid=105 and inv_id=111;
Query OK, 1 row affected (0.03 sec)

mysql> select * from invoice_item;
+--------+------+----------+
| inv_id | pid  | quantity |
+--------+------+----------+
|    112 |  102 |        3 |
|    114 |  101 |        2 |
|    115 |  103 |        4 |
|    112 |  103 |        4 |
|    115 |  105 |        3 |
+--------+------+----------+
4 rows in set (0.00 sec)






------------------------------------------------------------------------------------------------------------------







4. Delete details of customer who does not have phone number.

mysql> select * from customer;
+---------+----------+---------+-----------+-----------+
| cust_id | name     | address | city      | ph_no     |
+---------+----------+---------+-----------+-----------+
|       1 | Parvathi | ABC     | Tvm       | 919191919 |
|       2 | Reema    | WXY     | Kozhikode | 999999992 |
|       3 | Arun     | VWX     | Ekm       | 999999993 |
|       5 | Ram      | TUV     | Ekm       |      NULL |
+---------+----------+---------+-----------+-----------+
4 rows in set (0.00 sec)

mysql> delete from customer where ph_no is null;
Query OK, 1 row affected (0.03 sec)

mysql> select * from customer;
+---------+----------+---------+-----------+-----------+
| cust_id | name     | address | city      | ph_no     |
+---------+----------+---------+-----------+-----------+
|       1 | Parvathi | ABC     | Tvm       | 919191919 |
|       2 | Reema    | WXY     | Kozhikode | 999999992 |
|       3 | Arun     | VWX     | Ekm       | 999999993 |
+---------+----------+---------+-----------+-----------+
3 rows in set (0.00 sec)






------------------------------------------------------------------------------------------------------------------






5. Delete all records from STUDENT table.

mysql> select * from STUDENT;
+---------+---------+------+---------+--------+
| roll_no | name    | age  | address | gender |
+---------+---------+------+---------+--------+
|       1 | Anu     |   21 | ABC     | f      |
|       2 | Anupama |   21 | ABCD    | f      |
|       3 | Akhil   |   20 | ABCDE   | m      |
|       4 | Athul   |   23 | ABCDEF  | m      |
|       5 | Devika  |   23 | ABCDEFG | f      |
+---------+---------+------+---------+--------+
5 rows in set (0.00 sec)

mysql> delete from STUDENT;
Query OK, 5 rows affected (0.03 sec)

mysql> select * from STUDENT;
Empty set (0.00 sec)






------------------------------------------------------------------------------------------------------------------






6. Delete Invoice details of a particular customer.

mysql> select * from invoice_item;
+--------+------+----------+
| inv_id | pid  | quantity |
+--------+------+----------+
|    112 |  102 |        3 |
|    114 |  101 |        2 |
|    115 |  103 |        3 |
+--------+------+----------+
3 rows in set (0.00 sec)


mysql> delete from invoice_item where inv_id=115;
Query OK, 1 row affected (0.07 sec)

mysql> select * from invoice_item;
+--------+------+----------+
| inv_id | pid  | quantity |
+--------+------+----------+
|    112 |  102 |        3 |
|    114 |  101 |        2 |
+--------+------+----------+
2 rows in set (0.00 sec)

mysql> select * from invoice_master;
+--------+---------+------------+
| inv_id | cust_id | inv_date   |
+--------+---------+------------+
|    112 |       3 | 2022-02-02 |
|    113 |       1 | 2022-02-10 |
|    114 |       1 | 2022-03-25 |
|    115 |       3 | 2022-04-02 |
+--------+---------+------------+
4 rows in set (0.00 sec)

mysql> delete from invoice_master where inv_id=115;
Query OK, 1 row affected (0.04 sec)

mysql> select * from invoice_master;
+--------+---------+------------+
| inv_id | cust_id | inv_date   |
+--------+---------+------------+
|    112 |       3 | 2022-02-02 |
|    113 |       1 | 2022-02-10 |
|    114 |       1 | 2022-03-25 |
+--------+---------+------------+
3 rows in set (0.00 sec)







------------------------------------------------------------------------------------------------------------------



7. Delete the first two records of INVOICE_ITEM table its purchase quantity is high.

mysql> select * from invoice_item;                                              
+--------+------+----------+
| inv_id | pid  | quantity |
+--------+------+----------+
|    112 |  102 |        3 |
|    114 |  102 |        2 |
|    114 |  103 |        5 |
|    114 |  101 |        1 |
+--------+------+----------+
4 rows in set (0.00 sec)

mysql> select * from invoice_item order by quantity desc ;
+--------+------+----------+
| inv_id | pid  | quantity |
+--------+------+----------+
|    114 |  103 |        5 |
|    112 |  102 |        3 |
|    114 |  102 |        2 |
|    114 |  101 |        1 |
+--------+------+----------+
4 rows in set (0.00 sec)

mysql> delete from invoice_item order by quantity desc limit 2;
Query OK, 2 rows affected (0.04 sec)

mysql> select * from invoice_item;
+--------+------+----------+
| inv_id | pid  | quantity |
+--------+------+----------+
|    114 |  102 |        2 |
|    114 |  101 |        1 |
+--------+------+----------+
2 rows in set (0.00 sec)




//VERIFIED

